{
  "$schema": "./schemas/prophecy-match.schema.json",
  "game": "prophecy-match",
  "version": 1,
  "displayName": "Prophecy Match Challenge",
  "roundsPerSession": 5,
  "sessions": [
    {
      "id": "pm-session-01",
      "title": "Prophecy Match Set 01",
      "theme": "Recognized prophecy and fulfillment pairs",
      "rounds": [
        {
          "id": "pm-001",
          "title": "Seed Of The Woman",
          "theme": "Victory",
          "prophecyReference": "Genesis 3:15",
          "prophecySummary": "The serpent's head would be bruised by the woman's seed.",
          "prophecyTextShort": "It shall bruise thy head, and thou shalt bruise his heel.",
          "fulfillmentReference": "Hebrews 2:14",
          "fulfillmentSummary": "Christ is presented as defeating the devil through death.",
          "fulfillmentTextShort": "That through death he might destroy him that had the power of death.",
          "answerKey": "pm-seed",
          "difficulty": "medium",
          "teachingNote": "This is commonly read by Christian interpreters as an early promise of victory over evil."
        },
        {
          "id": "pm-002",
          "title": "Blessing To All Nations",
          "theme": "Nations",
          "prophecyReference": "Genesis 12:3",
          "prophecySummary": "All families of the earth would be blessed through Abram.",
          "prophecyTextShort": "In thee shall all families of the earth be blessed.",
          "fulfillmentReference": "Galatians 3:8",
          "fulfillmentSummary": "Paul connects the promise to the gospel blessing reaching Gentiles.",
          "fulfillmentTextShort": "In thee shall all nations be blessed.",
          "answerKey": "pm-nations",
          "difficulty": "easy",
          "teachingNote": "The New Testament explicitly applies this Abraham promise to the gospel going to the nations."
        },
        {
          "id": "pm-003",
          "title": "Ruler From Judah",
          "theme": "Kingship",
          "prophecyReference": "Genesis 49:10",
          "prophecySummary": "The sceptre is associated with Judah and a coming ruler.",
          "prophecyTextShort": "The sceptre shall not depart from Judah.",
          "fulfillmentReference": "Hebrews 7:14",
          "fulfillmentSummary": "Jesus is identified as coming from the tribe of Judah.",
          "fulfillmentTextShort": "Our Lord sprang out of Juda.",
          "answerKey": "pm-judah",
          "difficulty": "easy",
          "teachingNote": "The Judah connection is a widely recognized messianic theme."
        },
        {
          "id": "pm-004",
          "title": "Prophet Like Moses",
          "theme": "Prophet",
          "prophecyReference": "Deuteronomy 18:15",
          "prophecySummary": "The Lord would raise up a prophet like Moses.",
          "prophecyTextShort": "The Lord thy God will raise up unto thee a Prophet.",
          "fulfillmentReference": "Acts 3:22",
          "fulfillmentSummary": "Peter quotes this prophecy while preaching about Christ.",
          "fulfillmentTextShort": "A prophet shall the Lord your God raise up unto you.",
          "answerKey": "pm-prophet-like-moses",
          "difficulty": "medium",
          "teachingNote": "Acts gives this passage a direct place in apostolic preaching about Jesus."
        },
        {
          "id": "pm-005",
          "title": "Son And King",
          "theme": "Kingship",
          "prophecyReference": "Psalm 2:7",
          "prophecySummary": "The anointed king is addressed as God's Son.",
          "prophecyTextShort": "Thou art my Son; this day have I begotten thee.",
          "fulfillmentReference": "Acts 13:33",
          "fulfillmentSummary": "Paul quotes Psalm 2 in connection with Jesus being raised up.",
          "fulfillmentTextShort": "Thou art my Son, this day have I begotten thee.",
          "answerKey": "pm-son-king",
          "difficulty": "medium",
          "teachingNote": "Psalm 2 is used in the New Testament to speak of the Messiah's sonship and reign."
        }
      ]
    },
    {
      "id": "pm-session-02",
      "title": "Prophecy Match Set 02",
      "theme": "Recognized prophecy and fulfillment pairs",
      "rounds": [
        {
          "id": "pm-006",
          "title": "Not Seeing Corruption",
          "theme": "Resurrection",
          "prophecyReference": "Psalm 16:10",
          "prophecySummary": "The Holy One would not be left to corruption.",
          "prophecyTextShort": "Neither wilt thou suffer thine Holy One to see corruption.",
          "fulfillmentReference": "Acts 2:31",
          "fulfillmentSummary": "Peter says this was spoken of Christ's resurrection.",
          "fulfillmentTextShort": "His soul was not left in hell, neither his flesh did see corruption.",
          "answerKey": "pm-resurrection",
          "difficulty": "easy",
          "teachingNote": "Acts 2 directly connects Psalm 16 with the resurrection of Jesus."
        },
        {
          "id": "pm-007",
          "title": "Suffering Cry",
          "theme": "Suffering",
          "prophecyReference": "Psalm 22:1",
          "prophecySummary": "The psalm opens with a cry of being forsaken.",
          "prophecyTextShort": "My God, my God, why hast thou forsaken me?",
          "fulfillmentReference": "Matthew 27:46",
          "fulfillmentSummary": "Jesus speaks this line from the cross.",
          "fulfillmentTextShort": "My God, my God, why hast thou forsaken me?",
          "answerKey": "pm-forsaken",
          "difficulty": "easy",
          "teachingNote": "The Gospel records Jesus using Psalm 22 language during the crucifixion."
        },
        {
          "id": "pm-008",
          "title": "Garments Divided",
          "theme": "Suffering",
          "prophecyReference": "Psalm 22:18",
          "prophecySummary": "Garments are parted and lots are cast.",
          "prophecyTextShort": "They part my garments among them, and cast lots upon my vesture.",
          "fulfillmentReference": "John 19:24",
          "fulfillmentSummary": "Soldiers cast lots for Jesus' garment.",
          "fulfillmentTextShort": "They said therefore among themselves, Let us not rend it, but cast lots for it.",
          "answerKey": "pm-garments",
          "difficulty": "easy",
          "teachingNote": "John explicitly cites the casting of lots as fulfillment of scripture."
        },
        {
          "id": "pm-009",
          "title": "Bones Not Broken",
          "theme": "Suffering",
          "prophecyReference": "Psalm 34:20",
          "prophecySummary": "The righteous sufferer's bones are preserved.",
          "prophecyTextShort": "He keepeth all his bones: not one of them is broken.",
          "fulfillmentReference": "John 19:36",
          "fulfillmentSummary": "Jesus' bones were not broken at the crucifixion.",
          "fulfillmentTextShort": "A bone of him shall not be broken.",
          "answerKey": "pm-bones",
          "difficulty": "easy",
          "teachingNote": "John cites this detail while describing Jesus' death."
        },
        {
          "id": "pm-010",
          "title": "Betrayed By A Friend",
          "theme": "Betrayal",
          "prophecyReference": "Psalm 41:9",
          "prophecySummary": "A familiar friend lifts up his heel against the speaker.",
          "prophecyTextShort": "Mine own familiar friend... hath lifted up his heel against me.",
          "fulfillmentReference": "John 13:18",
          "fulfillmentSummary": "Jesus applies the text to betrayal within his circle.",
          "fulfillmentTextShort": "He that eateth bread with me hath lifted up his heel against me.",
          "answerKey": "pm-betrayal-friend",
          "difficulty": "easy",
          "teachingNote": "John records Jesus citing the psalm in the context of Judas's betrayal."
        }
      ]
    },
    {
      "id": "pm-session-03",
      "title": "Prophecy Match Set 03",
      "theme": "Recognized prophecy and fulfillment pairs",
      "rounds": [
        {
          "id": "pm-011",
          "title": "Zeal For God's House",
          "theme": "Temple",
          "prophecyReference": "Psalm 69:9",
          "prophecySummary": "Zeal for the Lord's house consumes the speaker.",
          "prophecyTextShort": "The zeal of thine house hath eaten me up.",
          "fulfillmentReference": "John 2:17",
          "fulfillmentSummary": "The disciples remember this scripture after Jesus cleanses the temple.",
          "fulfillmentTextShort": "The zeal of thine house hath eaten me up.",
          "answerKey": "pm-zeal",
          "difficulty": "medium",
          "teachingNote": "John presents the temple cleansing through the lens of Psalm 69."
        },
        {
          "id": "pm-012",
          "title": "Vinegar Given",
          "theme": "Suffering",
          "prophecyReference": "Psalm 69:21",
          "prophecySummary": "The suffering figure receives gall and vinegar.",
          "prophecyTextShort": "In my thirst they gave me vinegar to drink.",
          "fulfillmentReference": "John 19:29",
          "fulfillmentSummary": "Jesus is given vinegar during the crucifixion.",
          "fulfillmentTextShort": "They filled a spunge with vinegar... and put it to his mouth.",
          "answerKey": "pm-vinegar",
          "difficulty": "easy",
          "teachingNote": "The Gospels connect this detail with Jesus' crucifixion."
        },
        {
          "id": "pm-013",
          "title": "At God's Right Hand",
          "theme": "Exaltation",
          "prophecyReference": "Psalm 110:1",
          "prophecySummary": "The Lord invites David's Lord to sit at His right hand.",
          "prophecyTextShort": "Sit thou at my right hand.",
          "fulfillmentReference": "Hebrews 1:13",
          "fulfillmentSummary": "The verse is applied to the exalted Son.",
          "fulfillmentTextShort": "Sit on my right hand, until I make thine enemies thy footstool.",